category,description,title,institute,site,credits,id
,"Riemann sums and definite integrals; Fundamental Theorem; applications (areas); integration of exponential functions, trig functions, and inverse trig functions; techniques of integration (by parts, trig substitution, partial fractions); area, volume, and average value applications; differential equations (separable, exponential growth, linear); infinite sequences and series; convergence tests; power series; Taylor and Maclaurin series (computation, convergence, error estimates, differentiation and integration of Taylor series). 4 lecture hours plus 1 recitation session each week. Normally offered each semester.  ",MATH-166 Calculus II,Suffolk University,www.suffolk.edu,4.0,MATH-166
,"Parametric equations and polar coordinates (curves, areas, conic sections); vectors and the geometry of space (the dot product, vector arithmetic, lines and planes in 3-space, the cross product, cylinders and quadratic surfaces); vector functions (limits, derivatives and integrals, motion in space); partial derivatives (functions of several variables, limits and continuity, tangent planes and differentials, chain rule, directional derivatives, gradient, extrema, Lagrange multipliers); multiple integrals (double integrals, applications); vector calculus (vector fields, line integrals, fundamental theorem for line integrals, Green's Theorem, curl and divergence, parametric surfaces, surface integrals). 4 lecture hours plus 1 recitation session each week. Normally offered each semester.  ",MATH-265 Calculus III,Suffolk University,www.suffolk.edu,4.0,MATH-265
,"this course is intended to provide a firm foundation for and a taste of the study of advanced mathematics.  While the course content varies somewhat, it is designed to give students a deeper understanding of the algebraic and analytical structure of the integers, the rational numbers and the real numbers and how they act as a building block to a variety of fields of mathematics.  Students are introduced to the process of mathematical discovery and the language of mathematics.  Exercises  and projects are designed to illustrate the need for proof and to further refine the student's ability to analyze, conjecture and write mathematical proofs. This course is a prerequisite for most upper level mathematics courses and, after completing it a student will be in a position to determine realistically if he or she ought to major or minor in mathematics.",MATH-331 Introduction to Abstract Math,Suffolk University,www.suffolk.edu,4.0,MATH-331
,"A systematic introduction to the major thinkers and their positions on the main issues of ethics, such as: What is morality? What are moral values? How should we live our lives? Are there objective, universal, absolute moral standards? If so, what are they, and what is their basis? 1 term - credits. Normally offered every year.",PHIL-119 Ethics,Suffolk University,www.suffolk.edu,,PHIL-119
,"An examination of contemporary Western society, particularly in the United States, in relation to philosophical attempts to define the good life. Current books that exhibit a philosophical approach towards important contemporary social issues will be discussed, as well as classics in philosophy. Topics may include: civic virtue, consumerism, current events, economic justice, popular culture (film, music, television), religion and secularism, etc. 1 term - 4 credits.  Normally offered every year.",PHIL-123 Social Ethics: The Good Life,Suffolk University,www.suffolk.edu,,PHIL-123
,"A critical examination of a number of contemporary moral issues such as: abortion, affirmative action, animal rights, capital punishment, cloning, drug legalization, environmental ethics, euthanasia, genetic engineering, gun control, pornography, same-sex marriage, suicide, war and terrorism, etc. 1 term - 4 credits. Normally offered every year. ",PHIL-127 Contemporary Moral Issues,Suffolk University,www.suffolk.edu,,PHIL-127
"NATURAL SCIENCE FOR BA  BFA & BSJ,NATURAL SCIENCE FOR BS,SCI TECH ENGNR","Introduction to the fundamental principles of physics using calculus.  The course includes the study of vectors, Newton's laws, rotations, rigid body statics and dynamics, simple harmonic motion, heat and temperature.",PHYS-151 University Physics I,Suffolk University,www.suffolk.edu,3.0,PHYS-151
Social Science,Surveys core theoretical concepts and contemporary empirical research from the major sub-fields of psychology: physiology; perception; cognition; learning; emotion; motivation; development; personality; psychopathology; psychotherapy; and social behavior. Required for psychology majors. Offered every semester.,PSYCH-114 General Psychology,Suffolk University,www.suffolk.edu,,PSYCH-114
,"An overview of issues and social variables involved in the pre-arrest and arrest stages followed by a more in-depth analysis of pre-trial, trial, sentencing, and correctional phases. Sociological and criminal justice models are examined and compared with the actual processes and purported functions of criminal justice agencies. Required for all majors in the Crime and Justice Concentration.  ",SOC-234 Crime and Justice in American Society,Suffolk University,www.suffolk.edu,,SOC-234
